STT,Title
0," Tổng Bí thư, Chủ tịch nước Tô Lâm: Tập trung tháo gỡ vướng mắc về thể chế"
1,Người Việt ngóng huy chương
2,Hàn Quốc giành trọn số HC vàng bắn cung Olympic 2024
3,"Djokovic hạ Alcaraz, giành HC vàng Olympic"
4,Anh trải qua đợt bạo loạn tồi tệ nhất trong 13 năm
5,Cảnh sát phong tỏa nhà hàng karaoke hơn 12 giờ
6,Khoảng 4-6 cơn bão sẽ ảnh hưởng đến Việt Nam
7,Houthi tuyên bố hạ UAV hàng chục triệu USD của Mỹ
8,Sĩ số lớp ở trường tiểu học không quá 35
9,Cặp đôi cùng nhau vô địch Olympic 2024 sau ba tuần chia tay
10,Ngân sách hụt thu gần 20.000 tỷ đồng do giảm thuế môi trường xăng dầu
11,Trump chúc mừng ông Putin vì thỏa thuận tù nhân Mỹ - Nga
12,Bi kịch lại đến với cựu vô địch cầu lông ở Olympic 2024
13,"Tài xế không bằng lái, chạy ôtô ngược chiều trên cao tốc"
14,"Miền Bắc giảm mưa, chuyển nắng nóng"
15,Thu hơn 114.000 tỷ thuế thu nhập cá nhân trong 7 tháng
16,Người đàn ông Campuchia bị bắt khi mang túi vàng qua biên giới
17,Sạt lở đất vùi lấp vợ chồng ở Lạng Sơn
18,Cô gái trốn truy nã bị bắt khi vừa xuống máy bay
19,Quế Anh: 'Tôi may mắn sinh ra trong gia đình gia giáo'
20,Pháp kêu gọi công dân rời Lebanon
21,Chuyên gia: Luật Dẫn độ sẽ giải quyết được nhiều vấn đề đối với tội phạm
22,Cấp sổ đỏ lần đầu không quá 3 ngày làm việc
23,Hezbollah phóng hơn 50 rocket vào Israel
24,Màn trở lại ấn tượng của huyền thoại TDDC Simone Biles
